{
  "actor": {
    "agent_id": "canon",
    "role": "implementer"
  },
  "at": "2026-08-06T09:46:56.105922Z",
  "domain": "dev",
  "kind": "subject",
  "owner_role": "implementer",
  "schema": 1,
  "status": "proposed",
  "subject_id": "divergence-lifecycle",
  "summary": "",
  "title": "Divergence: stage, promote, resolve, expire"
}