{
  "actor": {
    "agent_id": "canon",
    "role": "implementer"
  },
  "at": "2026-10-26T10:04:14.047741901Z",
  "change_ids": [
    "canon-0-30-ledger-naming",
    "canon-0-30-rust-sweep",
    "canon-0-30-spec-backfill",
    "canon-0-30-record-links"
  ],
  "domain": "dev",
  "kind": "subject",
  "owner_role": "implementer",
  "schema": 1,
  "status": "verifying",
  "subject_id": "tier-storage",
  "summary": "",
  "title": "Tier: storage rungs, routing, and aging"
}